{
  "run_id": "SYS-2026-08-30-913",
  "schema_version": "1.0",
  "started_at": "2026-08-30T01:48:01.576647+00:00",
  "completed_at": null,
  "status": "IN_PROGRESS",
  "cadence": "ON_DEMAND",
  "trigger": "script_hook",
  "agent_roles": [
    "Deterministic Script"
  ],
  "prompt_ref": null,
  "runtime_context_signature": null,
  "summary": "Script auto-hook session",
  "deliverables": [],
  "events": [
    {
      "event_id": "EVT-2026-08-30-001",
      "recorded_at": "2026-08-30T01:48:01.599054+00:00",
      "event_type": "RESEARCH_FIELD_UPDATED",
      "agent_role": "Deterministic Script",
      "subject": "Updated research.authoring_model for CVX",
      "symbol": "CVX",
      "target_path": "context/data/equities/CVX.json#research.authoring_model",
      "change": {
        "field": "authoring_model",
        "before_hash": "sha256:aeedf5d3103bf48b766788f6a1e2a882546aba7bdf766f2898e582adcca00594",
        "after_hash": "sha256:13263da7054b311d9acd21ccbedc2eb9d2854f80f667c223f578170715f0c890"
      }
    }
  ]
}
