{
  "run_id": "SYS-2026-08-30-572",
  "schema_version": "1.0",
  "started_at": "2026-08-30T01:47:52.505426+00:00",
  "completed_at": null,
  "status": "IN_PROGRESS",
  "cadence": "ON_DEMAND",
  "trigger": "script_hook",
  "agent_roles": [
    "Deterministic Script"
  ],
  "prompt_ref": null,
  "runtime_context_signature": null,
  "summary": "Script auto-hook session",
  "deliverables": [],
  "events": [
    {
      "event_id": "EVT-2026-08-30-001",
      "recorded_at": "2026-08-30T01:47:52.526012+00:00",
      "event_type": "RESEARCH_FIELD_UPDATED",
      "agent_role": "Deterministic Script",
      "subject": "Updated research.business_profile for BSX",
      "symbol": "BSX",
      "target_path": "context/data/equities/BSX.json#research.business_profile",
      "change": {
        "field": "business_profile",
        "before_chars": 865,
        "after_chars": 865,
        "before_hash": "sha256:4ab68748b9146cb1debe4e27841b4a66b34660964d6efe6c9e0ae1f0b8972bf6",
        "after_hash": "sha256:4ab68748b9146cb1debe4e27841b4a66b34660964d6efe6c9e0ae1f0b8972bf6"
      }
    }
  ]
}
