{
  "run_id": "SYS-2026-08-30-925",
  "schema_version": "1.0",
  "started_at": "2026-08-30T01:48:01.886310+00:00",
  "completed_at": null,
  "status": "IN_PROGRESS",
  "cadence": "ON_DEMAND",
  "trigger": "script_hook",
  "agent_roles": [
    "Deterministic Script"
  ],
  "prompt_ref": null,
  "runtime_context_signature": null,
  "summary": "Script auto-hook session",
  "deliverables": [],
  "events": [
    {
      "event_id": "EVT-2026-08-30-001",
      "recorded_at": "2026-08-30T01:48:01.910011+00:00",
      "event_type": "RESEARCH_FIELD_UPDATED",
      "agent_role": "Deterministic Script",
      "subject": "Updated research.prompt_version for CVX",
      "symbol": "CVX",
      "target_path": "context/data/equities/CVX.json#research.prompt_version",
      "change": {
        "field": "prompt_version",
        "before_hash": "sha256:aeedf5d3103bf48b766788f6a1e2a882546aba7bdf766f2898e582adcca00594",
        "after_hash": "sha256:dbf9dffbf777df05b4041aeef8c41ad3f60c71c7f49b60e587aa496cc0f0919f"
      }
    }
  ]
}
