{
  "run_id": "SYS-2026-08-30-651",
  "schema_version": "1.0",
  "started_at": "2026-08-30T01:47:54.511719+00:00",
  "completed_at": null,
  "status": "IN_PROGRESS",
  "cadence": "ON_DEMAND",
  "trigger": "script_hook",
  "agent_roles": [
    "Deterministic Script"
  ],
  "prompt_ref": null,
  "runtime_context_signature": null,
  "summary": "Script auto-hook session",
  "deliverables": [],
  "events": [
    {
      "event_id": "EVT-2026-08-30-001",
      "recorded_at": "2026-08-30T01:47:54.535724+00:00",
      "event_type": "RESEARCH_FIELD_UPDATED",
      "agent_role": "Deterministic Script",
      "subject": "Updated research.competitive_moat_analysis for CDNS",
      "symbol": "CDNS",
      "target_path": "context/data/equities/CDNS.json#research.competitive_moat_analysis",
      "change": {
        "field": "competitive_moat_analysis",
        "before_chars": 509,
        "after_chars": 509,
        "before_hash": "sha256:7078afc6a688cedc71ae9039a51f7b50a13da78bf3382ab7fe48de7523fa0939",
        "after_hash": "sha256:7078afc6a688cedc71ae9039a51f7b50a13da78bf3382ab7fe48de7523fa0939"
      }
    }
  ]
}
