{
  "run_id": "SYS-2026-08-30-198",
  "schema_version": "1.0",
  "started_at": "2026-08-30T01:47:42.895017+00:00",
  "completed_at": null,
  "status": "IN_PROGRESS",
  "cadence": "ON_DEMAND",
  "trigger": "script_hook",
  "agent_roles": [
    "Deterministic Script"
  ],
  "prompt_ref": null,
  "runtime_context_signature": null,
  "summary": "Script auto-hook session",
  "deliverables": [],
  "events": [
    {
      "event_id": "EVT-2026-08-30-001",
      "recorded_at": "2026-08-30T01:47:42.914804+00:00",
      "event_type": "RESEARCH_FIELD_AUTHORED",
      "agent_role": "Deterministic Script",
      "subject": "Authored research.forecast_scenarios for ALGN",
      "symbol": "ALGN",
      "target_path": "context/data/equities/ALGN.json#research.forecast_scenarios",
      "change": {
        "field": "forecast_scenarios",
        "before_hash": null,
        "after_hash": "sha256:d6ad8991365dadb513ce20cf63d3b018a56cc169035578a91c47e77390e81675"
      }
    }
  ]
}
