{
  "run_id": "SYS-2026-08-30-566",
  "schema_version": "1.0",
  "started_at": "2026-08-30T01:47:52.317983+00:00",
  "completed_at": null,
  "status": "IN_PROGRESS",
  "cadence": "ON_DEMAND",
  "trigger": "script_hook",
  "agent_roles": [
    "Deterministic Script"
  ],
  "prompt_ref": null,
  "runtime_context_signature": null,
  "summary": "Script auto-hook session",
  "deliverables": [],
  "events": [
    {
      "event_id": "EVT-2026-08-30-001",
      "recorded_at": "2026-08-30T01:47:52.342094+00:00",
      "event_type": "RESEARCH_FIELD_UPDATED",
      "agent_role": "Deterministic Script",
      "subject": "Updated research.revenue_drivers_narrative for BRK-B",
      "symbol": "BRK-B",
      "target_path": "context/data/equities/BRK-B.json#research.revenue_drivers_narrative",
      "change": {
        "field": "revenue_drivers_narrative",
        "before_chars": 579,
        "after_chars": 579,
        "before_hash": "sha256:e483ad573d69c6adae5d36d7f5282b6778abaa3274bdfa9c8b24b8c6c04242e9",
        "after_hash": "sha256:e483ad573d69c6adae5d36d7f5282b6778abaa3274bdfa9c8b24b8c6c04242e9"
      }
    }
  ]
}
