{
  "run_id": "SYS-2026-08-30-068",
  "schema_version": "1.0",
  "started_at": "2026-08-30T01:47:39.470952+00:00",
  "completed_at": null,
  "status": "IN_PROGRESS",
  "cadence": "ON_DEMAND",
  "trigger": "script_hook",
  "agent_roles": [
    "Deterministic Script"
  ],
  "prompt_ref": null,
  "runtime_context_signature": null,
  "summary": "Script auto-hook session",
  "deliverables": [],
  "events": [
    {
      "event_id": "EVT-2026-08-30-001",
      "recorded_at": "2026-08-30T01:47:39.492624+00:00",
      "event_type": "RESEARCH_FIELD_UPDATED",
      "agent_role": "Deterministic Script",
      "subject": "Updated research.moat_summary for ABT",
      "symbol": "ABT",
      "target_path": "context/data/equities/ABT.json#research.moat_summary",
      "change": {
        "field": "moat_summary",
        "before_chars": 300,
        "after_chars": 300,
        "before_hash": "sha256:c8fe3585e507de22ae2dac6a3a8c90e242ec422cd9b87876c1bc6530609bd20d",
        "after_hash": "sha256:c8fe3585e507de22ae2dac6a3a8c90e242ec422cd9b87876c1bc6530609bd20d"
      }
    }
  ]
}
