{
  "run_id": "SYS-2026-08-30-624",
  "schema_version": "1.0",
  "started_at": "2026-08-30T01:47:53.814106+00:00",
  "completed_at": null,
  "status": "IN_PROGRESS",
  "cadence": "ON_DEMAND",
  "trigger": "script_hook",
  "agent_roles": [
    "Deterministic Script"
  ],
  "prompt_ref": null,
  "runtime_context_signature": null,
  "summary": "Script auto-hook session",
  "deliverables": [],
  "events": [
    {
      "event_id": "EVT-2026-08-30-001",
      "recorded_at": "2026-08-30T01:47:53.836251+00:00",
      "event_type": "RESEARCH_FIELD_UPDATED",
      "agent_role": "Deterministic Script",
      "subject": "Updated research.stock_based_compensation for CAVA",
      "symbol": "CAVA",
      "target_path": "context/data/equities/CAVA.json#research.stock_based_compensation",
      "change": {
        "field": "stock_based_compensation",
        "before_hash": "sha256:59ef00f9f752e10c007467c7770da1c29011338e02f09af47a193b4415ffa47a",
        "after_hash": "sha256:b8029f76cd7f4c34384b50c976f436245f928d1a3ad1a8546d38bcdd43a06f4f"
      }
    }
  ]
}
