{
  "run_id": "SYS-2026-08-30-904",
  "schema_version": "1.0",
  "started_at": "2026-08-30T01:48:01.319516+00:00",
  "completed_at": null,
  "status": "IN_PROGRESS",
  "cadence": "ON_DEMAND",
  "trigger": "script_hook",
  "agent_roles": [
    "Deterministic Script"
  ],
  "prompt_ref": null,
  "runtime_context_signature": null,
  "summary": "Script auto-hook session",
  "deliverables": [],
  "events": [
    {
      "event_id": "EVT-2026-08-30-001",
      "recorded_at": "2026-08-30T01:48:01.341373+00:00",
      "event_type": "RESEARCH_FIELD_UPDATED",
      "agent_role": "Deterministic Script",
      "subject": "Updated research.moat_summary for CTSH",
      "symbol": "CTSH",
      "target_path": "context/data/equities/CTSH.json#research.moat_summary",
      "change": {
        "field": "moat_summary",
        "before_chars": 126,
        "after_chars": 126,
        "before_hash": "sha256:55a3f176611ff462618f8a8ec434a95c7c92e1b8d331f5542154a8d9d1d024f3",
        "after_hash": "sha256:55a3f176611ff462618f8a8ec434a95c7c92e1b8d331f5542154a8d9d1d024f3"
      }
    }
  ]
}
