{
  "run_id": "SYS-2026-08-30-921",
  "schema_version": "1.0",
  "started_at": "2026-08-30T01:48:01.788079+00:00",
  "completed_at": null,
  "status": "IN_PROGRESS",
  "cadence": "ON_DEMAND",
  "trigger": "script_hook",
  "agent_roles": [
    "Deterministic Script"
  ],
  "prompt_ref": null,
  "runtime_context_signature": null,
  "summary": "Script auto-hook session",
  "deliverables": [],
  "events": [
    {
      "event_id": "EVT-2026-08-30-001",
      "recorded_at": "2026-08-30T01:48:01.808328+00:00",
      "event_type": "RESEARCH_FIELD_UPDATED",
      "agent_role": "Deterministic Script",
      "subject": "Updated research.invalidation_criteria for CVX",
      "symbol": "CVX",
      "target_path": "context/data/equities/CVX.json#research.invalidation_criteria",
      "change": {
        "field": "invalidation_criteria",
        "before_hash": "sha256:9e8b98bb289d46af349801ca2e83d590f8eef2bae67340e786e9976e4ee3a6bd",
        "after_hash": "sha256:152e607119ca44cb0e200aa24629fed4d4d74d72ef4abb9a292824597bd305ac"
      }
    }
  ]
}
