{
  "run_id": "SYS-2026-08-30-087",
  "schema_version": "1.0",
  "started_at": "2026-08-30T01:47:39.972816+00:00",
  "completed_at": null,
  "status": "IN_PROGRESS",
  "cadence": "ON_DEMAND",
  "trigger": "script_hook",
  "agent_roles": [
    "Deterministic Script"
  ],
  "prompt_ref": null,
  "runtime_context_signature": null,
  "summary": "Script auto-hook session",
  "deliverables": [],
  "events": [
    {
      "event_id": "EVT-2026-08-30-001",
      "recorded_at": "2026-08-30T01:47:39.992499+00:00",
      "event_type": "RESEARCH_FIELD_UPDATED",
      "agent_role": "Deterministic Script",
      "subject": "Updated research.moat_summary for ACN",
      "symbol": "ACN",
      "target_path": "context/data/equities/ACN.json#research.moat_summary",
      "change": {
        "field": "moat_summary",
        "before_chars": 300,
        "after_chars": 300,
        "before_hash": "sha256:f8f04675194e8f7903ffe31098166c23118c873f523dcc3e1795c479708bd5cb",
        "after_hash": "sha256:f8f04675194e8f7903ffe31098166c23118c873f523dcc3e1795c479708bd5cb"
      }
    }
  ]
}
