{
  "run_id": "SYS-2026-08-30-472",
  "schema_version": "1.0",
  "started_at": "2026-08-30T01:47:49.896123+00:00",
  "completed_at": null,
  "status": "IN_PROGRESS",
  "cadence": "ON_DEMAND",
  "trigger": "script_hook",
  "agent_roles": [
    "Deterministic Script"
  ],
  "prompt_ref": null,
  "runtime_context_signature": null,
  "summary": "Script auto-hook session",
  "deliverables": [],
  "events": [
    {
      "event_id": "EVT-2026-08-30-001",
      "recorded_at": "2026-08-30T01:47:49.920372+00:00",
      "event_type": "RESEARCH_FIELD_UPDATED",
      "agent_role": "Deterministic Script",
      "subject": "Updated research.stock_based_compensation for BA",
      "symbol": "BA",
      "target_path": "context/data/equities/BA.json#research.stock_based_compensation",
      "change": {
        "field": "stock_based_compensation",
        "before_hash": "sha256:bf28a4e714c3ec7d7c820f5bd1907978db3948a932b1375063c9a7d39a986a49",
        "after_hash": "sha256:09a7dbd342d1ecda2e99d68f96c747c502659173d4b36cfd4715849fbfbaaa90"
      }
    }
  ]
}
