{
  "run_id": "SYS-2026-08-30-276",
  "schema_version": "1.0",
  "started_at": "2026-08-30T01:47:44.874916+00:00",
  "completed_at": null,
  "status": "IN_PROGRESS",
  "cadence": "ON_DEMAND",
  "trigger": "script_hook",
  "agent_roles": [
    "Deterministic Script"
  ],
  "prompt_ref": null,
  "runtime_context_signature": null,
  "summary": "Script auto-hook session",
  "deliverables": [],
  "events": [
    {
      "event_id": "EVT-2026-08-30-001",
      "recorded_at": "2026-08-30T01:47:44.899923+00:00",
      "event_type": "RESEARCH_FIELD_UPDATED",
      "agent_role": "Deterministic Script",
      "subject": "Updated research.latest_catalyst for AMGN",
      "symbol": "AMGN",
      "target_path": "context/data/equities/AMGN.json#research.latest_catalyst",
      "change": {
        "field": "latest_catalyst",
        "before_chars": 82,
        "after_chars": 82,
        "before_hash": "sha256:afa288fda688bd0dcea07560ab8eca1a26e1808881b0b83d8ebd7ff90e4be916",
        "after_hash": "sha256:afa288fda688bd0dcea07560ab8eca1a26e1808881b0b83d8ebd7ff90e4be916"
      }
    }
  ]
}
