{
  "run_id": "SYS-2026-08-30-714",
  "schema_version": "1.0",
  "started_at": "2026-08-30T01:47:56.191566+00:00",
  "completed_at": null,
  "status": "IN_PROGRESS",
  "cadence": "ON_DEMAND",
  "trigger": "script_hook",
  "agent_roles": [
    "Deterministic Script"
  ],
  "prompt_ref": null,
  "runtime_context_signature": null,
  "summary": "Script auto-hook session",
  "deliverables": [],
  "events": [
    {
      "event_id": "EVT-2026-08-30-001",
      "recorded_at": "2026-08-30T01:47:56.212993+00:00",
      "event_type": "RESEARCH_FIELD_UPDATED",
      "agent_role": "Deterministic Script",
      "subject": "Updated research.moat_summary for CMCSA",
      "symbol": "CMCSA",
      "target_path": "context/data/equities/CMCSA.json#research.moat_summary",
      "change": {
        "field": "moat_summary",
        "before_chars": 142,
        "after_chars": 142,
        "before_hash": "sha256:de26e00cd802137a6b68f391946993c478867623d39f2c6bc312c807d537ea87",
        "after_hash": "sha256:de26e00cd802137a6b68f391946993c478867623d39f2c6bc312c807d537ea87"
      }
    }
  ]
}
