{
  "run_id": "SYS-2026-08-30-228",
  "schema_version": "1.0",
  "started_at": "2026-08-30T01:47:43.621736+00:00",
  "completed_at": null,
  "status": "IN_PROGRESS",
  "cadence": "ON_DEMAND",
  "trigger": "script_hook",
  "agent_roles": [
    "Deterministic Script"
  ],
  "prompt_ref": null,
  "runtime_context_signature": null,
  "summary": "Script auto-hook session",
  "deliverables": [],
  "events": [
    {
      "event_id": "EVT-2026-08-30-001",
      "recorded_at": "2026-08-30T01:47:43.642099+00:00",
      "event_type": "RESEARCH_FIELD_UPDATED",
      "agent_role": "Deterministic Script",
      "subject": "Updated research.valuation_ps_multiple_narrative for ALNY",
      "symbol": "ALNY",
      "target_path": "context/data/equities/ALNY.json#research.valuation_ps_multiple_narrative",
      "change": {
        "field": "valuation_ps_multiple_narrative",
        "before_chars": 227,
        "after_chars": 227,
        "before_hash": "sha256:d89a7e13848ec79473b4bba7c0840dd3570f7f00ef28dc2b09c3501b898f7ee9",
        "after_hash": "sha256:d89a7e13848ec79473b4bba7c0840dd3570f7f00ef28dc2b09c3501b898f7ee9"
      }
    }
  ]
}
