{
  "run_id": "SYS-2026-08-30-733",
  "schema_version": "1.0",
  "started_at": "2026-08-30T01:47:56.690726+00:00",
  "completed_at": null,
  "status": "IN_PROGRESS",
  "cadence": "ON_DEMAND",
  "trigger": "script_hook",
  "agent_roles": [
    "Deterministic Script"
  ],
  "prompt_ref": null,
  "runtime_context_signature": null,
  "summary": "Script auto-hook session",
  "deliverables": [],
  "events": [
    {
      "event_id": "EVT-2026-08-30-001",
      "recorded_at": "2026-08-30T01:47:56.711505+00:00",
      "event_type": "RESEARCH_FIELD_UPDATED",
      "agent_role": "Deterministic Script",
      "subject": "Updated research.moat_summary for CME",
      "symbol": "CME",
      "target_path": "context/data/equities/CME.json#research.moat_summary",
      "change": {
        "field": "moat_summary",
        "before_chars": 300,
        "after_chars": 300,
        "before_hash": "sha256:0d23737d493621fd99e3002d149fc2db5f18ba05b756bd658e060ae307c8a971",
        "after_hash": "sha256:0d23737d493621fd99e3002d149fc2db5f18ba05b756bd658e060ae307c8a971"
      }
    }
  ]
}
