{
  "run_id": "SYS-2026-08-30-561",
  "schema_version": "1.0",
  "started_at": "2026-08-30T01:47:52.197259+00:00",
  "completed_at": null,
  "status": "IN_PROGRESS",
  "cadence": "ON_DEMAND",
  "trigger": "script_hook",
  "agent_roles": [
    "Deterministic Script"
  ],
  "prompt_ref": null,
  "runtime_context_signature": null,
  "summary": "Script auto-hook session",
  "deliverables": [],
  "events": [
    {
      "event_id": "EVT-2026-08-30-001",
      "recorded_at": "2026-08-30T01:47:52.215508+00:00",
      "event_type": "RESEARCH_FIELD_UPDATED",
      "agent_role": "Deterministic Script",
      "subject": "Updated research.latest_catalyst for BRK-B",
      "symbol": "BRK-B",
      "target_path": "context/data/equities/BRK-B.json#research.latest_catalyst",
      "change": {
        "field": "latest_catalyst",
        "before_chars": 107,
        "after_chars": 107,
        "before_hash": "sha256:e22bccd355a290648aa89fad67170d86c39de7f94d533481c455c465aa9651ff",
        "after_hash": "sha256:e22bccd355a290648aa89fad67170d86c39de7f94d533481c455c465aa9651ff"
      }
    }
  ]
}
